REMARKS,scomminc ID,scomminc title,Session Number,order within session,Paper ID,Authors,Title,title match?
,fp0464,A Cooperative Multi-Agent Reinforcement Learning Framework for Resource Balancing in Complex Logistics Network,4A: Learning Agent Capabilities,1,464,"Xihan Li ,Jia Zhang ,Jiang Bian ,Tie-Yan Liu ,Yunhai Tong ",A Cooperative Multi-Agent Reinforcement Learning Framework for Resource Balancing in Complex Logistics Network,TRUE
,fp1007,Context-Aware Policy Reuse,4A: Learning Agent Capabilities,2,1007,"Siyuan Li ,Fangda Gu ,Guangxiang Zhu ,Chongjie Zhang ",Context-Aware Policy Reuse,TRUE
,fp0552,Playing Atari with Six Neurons,4A: Learning Agent Capabilities,3,552,"Giuseppe Cuccu , Julian Togelius  , Philippe Cudré-Mauroux",Playing Atari with Six Neurons,TRUE
,fp0206,PLOTS: Procedure Learning from Observations using subTask Structure,4A: Learning Agent Capabilities,4,206,"Tong Mu,Karan Goel,Emma Brunskill",PLOTS: Procedure Learning from Observations using subTask Structure,TRUE
,fp0720,Reducing Sampling Error in Policy Gradient Learning,4A: Learning Agent Capabilities,5,720,"Josiah Hanna ,Peter Stone ",Reducing Sampling Error in Policy Gradient Learning,TRUE
not clear if title formatting will work…?,fp0355,TBQ(&#963;): Improving Efficiency of Trace Utilization for Off-Policy Reinforcement Learning,4A: Learning Agent Capabilities,6,355,"Longxiang Shi ,Shijian Li ,Longbing Cao ,Long Yang ,Gang Pan ",TBQ(\sigma): Improving Efficiency of Traces Utilization for Off-Policy Reinforcement Learning,FALSE
,fp0549,A Grounded Interaction Protocol for Explainable Artificial Intelligence,4B: Multimodal Interaction,1,549,"Prashan Madumal ,Tim Miller ,Liz Sonenberg ,Frank Vetere ",A Grounded Interaction Protocol for Explainable Artificial Intelligence,TRUE
,fp0255,Community Regularization of Visually-Grounded Dialog,4B: Multimodal Interaction,2,255,"Swaminathan Gurumurthy ,Katia Sycara,Akshat Agarwal  ,Vasu Sharma ,Mike Lewis",Community Regularization of Visually Grounded Dialog,FALSE
,fp0195,What If I Speak Now? A Decision-Theoretic Approach to Personality-Based Turn-Taking,4B: Multimodal Interaction,3,195,"Kathrin Janowski ,Elisabeth Andre",What If I Speak Now? A Decision-Theoretic Approach to Personality-Based Turn-Taking,TRUE
,fp0583,Exploring Improvisational Approaches to Social Knowledge Acquisition,4B: Multimodal Interaction,4,583,"Dan Feng ,Elin Carstensdottir ,Magy Seif El-Nasr ,Stacy Marsella ",Exploring improvisational approaches to social knowledge acquisition,FALSE
,fp0380,Protagonist vs Antagonist PROVANT: Narrative Generation as Counter Planning,4B: Multimodal Interaction,5,380,"Julie Porteous ,Alan Lindsay ",Protagonist vs Antagonist PROVANT: Narrative Generation as Counter Planning,TRUE
,fp0990,Explainable Agents and Robots: Results from a Systematic Literature Review,4B: Multimodal Interaction,6,990,"Sule Anjomshoae   , Amro Najjar  , Davide Calvaresi   , Kary Främling",Explainable agents and robots: Results from a systematic literature review,FALSE
,fp0418,Improved Cooperative Multi-agent Reinforcement Learning Algorithm Augmented by Mixing Demonstrations from Centralized Policy,4C: Deep Learning,1,418,"Hyun-Rok Lee ,Taesik Lee ",Improved Cooperative Multi-agent Reinforcement Learning Algorithm Augmented by Mixing Demonstrations from Centralized Policy,TRUE
,fp0180,Malthusian Reinforcement Learning,4C: Deep Learning,2,180,"Joel Leibo  ,Edward Hughes  ,Edgar Duenez ,Peter Sunehag ,Thore Graepel  ,Steven Wheelwright ,Adam Marblestone ,Iain Dunning",Malthusian Reinforcement Learning,TRUE
,fp0016,Modelling the Dynamic Joint Policy of Teammates with Attention Multi-agent DDPG,4C: Deep Learning,3,16,"Hangyu Mao , Zhengchao Zhang , Zhen Xiao , Zhibo Gong",Modelling the Dynamic Joint Policy of Teammates with Attention Multi-agent DDPG,TRUE
,fp0842,Observational Learning by Reinforcement Learning,4C: Deep Learning,4,842,"Diana Borsa ,Nicolas Hess ,Bilal Piot ,Siqi Liu ,Leonard Hasenclever ,Remi Munos ,Olivier Pietquin ",Observational Learning by Reinforcement Learning,TRUE
,fp0585,Online Abstraction with MDP Homomorphisms for Deep Learning,4C: Deep Learning,5,585,"Ondrej Biza ,Robert Platt ",Online abstraction with MDP homomorphisms for Deep Learning,FALSE
,fp0670,The Body is Not a Given: Joint Agent Policy Learning and Morphology Evolution,4C: Deep Learning,6,670,"Dylan Banarse ,Yoram Bachrach ,Siqi Liu ,Guy Lever ,Nicolas Hess ,Chrisantha Fernando ,Pushmeet Kohli ,Thore Graepel ",The Body is not a Given: Joint Agent Policy Learning and Morphology Evolution,FALSE
,fp0599,Information Gathering in Decentralized POMDPs by Policy Graph Improvement,4D: Robotics,1,599,"Mikko Lauri ,Joni Pajarinen ,Jan Peters ",Information gathering in decentralized POMDPs by policy graph improvement,FALSE
,fp0305,Task and Path Planning for Multi-Agent Pickup and Delivery,4D: Robotics,2,305,"Minghua Liu ,Hang Ma ,Jiaoyang Li ,Sven Koenig",Task and Path Planning for Multi-Agent Pickup and Delivery,TRUE
,fp0827,Fully Convolutional One-Shot Object Segmentation for Industrial Robotics,4D: Robotics,3,827,"Benjamin Schnieders ,Shan Luo ,Gregory Palmer ,Karl Tuyls ",Fully Convolutional One-Shot Object Segmentation for Industrial Robotics,TRUE
,fp0642,Online Inverse Reinforcement Learning Under Occlusion,4D: Robotics,4,642,"Saurabh Arora ,Prashant Doshi ,Bikramjit Banerjee ",Online Inverse Reinforcement Learning under Occlusion,FALSE
,fp0361,Patrol Scheduling Against Adversaries with Varying Attack Durations,4D: Robotics,5,361,"Hao-Tsung Yang ,Shih-Yu Tsai ,Kin Sum Liu ,Shan Lin ,Jie Gao ",Patrol Scheduling Against Adversaries with Varying Attack Durations,TRUE
,fp0323,Optimal Online Coverage Path Planning with Energy Constraints,4D: Robotics,6,323,"Gokarna Sharma ,Ayan Dutta ,Jong-Hoon Kim ",Optimal Online Coverage Path Planning with Energy Constraints,TRUE
,fp0838,Cooperative Concurrent Games,4E: Game Theory 3,1,838,"Julian Gutierrez ,Sarit Kraus ,Michael Wooldridge ",Cooperative Concurrent Games,TRUE
,fp0443,Maximizing the Spread of an Opinion when Tertium Datur Est,4E: Game Theory 3,2,443,"Vincenzo Auletta ,Diodato Ferraioli ,Valeria Fionda ,Gianluigi Greco ",Maximizing the Spread of an Opinion when Tertium Datur Est,TRUE
,fp0120,Obtaining Costly Unverifiable Valuations from a Single Agent,4E: Game Theory 3,3,120,"Erel Segal-Halevi ,Shani Alkoby,Tomer Sharbaf,David Sarne",Obtaining Costly Unverifiable Valuations from a Single Agent,TRUE
,fp0150,Tracing Equilibrium in Dynamic Markets via Distributed Adaptation,4E: Game Theory 3,4,150,"Yun Kuen Cheung ,Martin Hoefer,Paresh Nakhe",Tracing Equilibrium in Dynamic Markets via Distributed Adaptation,TRUE
,fp0510,Truthfulness on a Budget: Trading Money for Approximation through Monitoring,4E: Game Theory 3,5,510,"Paolo Serafino ,Carmine Ventre ,Angelina Vidali ",Truthfulness on a Budget: Trading Money for Approximation through Monitoring,TRUE
,fp0570,Well-behaved Online Load Balancing Against Strategic Jobs,4E: Game Theory 3,6,570,"Bo Li ,Minming Li ,Xiaowei Wu ",Well-behaved Online Load Balancing Against Strategic Jobs,TRUE
,fp0437,Argumentation-based Negotiation with Incomplete Opponent Profiles,4F: Communication and Argumentation 1,1,437,"Yannis Dimopoulos ,Jean-Guy Mailly ,Pavlos Moraitis ",Argumentation-based Negotiation with Incomplete Opponent Profiles,TRUE
,fp0516,Extracting Dialogical Explanations for Review Aggregations with Argumentative Dialogical Agents,4F: Communication and Argumentation 1,2,516,"Oana Cocarascu ,Antonio Rago ,Francesca Toni ",Extracting Dialogical Explanations for Review Aggregations with Argumentative Dialogical Agents,TRUE
,fp0469,Gradual Semantics Accounting for Varied-Strength Attacks,4F: Communication and Argumentation 1,3,469,"Leila Amgoud ,Dragan Doder ",Gradual Semantics Accounting for Varied-Strength Attacks,TRUE
,fp0055,On an Argument-centric Persuasion Framework,4F: Communication and Argumentation 1,4,55,Yakoub Salhi,On an Argument-centric Persuasion Framework,TRUE
,fp0427,Single Transferable Vote: Incomplete Knowledge and Communication Issues,4F: Communication and Argumentation 1,5,427,"Manel Ayadi ,Nahla Ben Amor ,Jerome Lang ,Dominik Peters ",Single Transferable Vote: Incomplete Knowledge and Communication Issues,TRUE
,fp0533,Learning Plans by Acquiring Grounded Linguistic Meanings from Corrections,4F: Communication and Argumentation 1,6,533,"Mattias Appelgren ,Alex Lascarides ",Learning Plans by Acquiring Grounded Linguistic Meanings from Corrections,TRUE
,fp0707,A New Concept of Convex based Multiple Neural Networks Structure,5A: Learning Agents,1,707,"Yu Wang ,Hongxia Jin ",A New Concept of Convex based Multiple Neural Networks Structure,TRUE
,fp0400,Independent Generative Adversarial Self-Imitation Learning in Cooperative Multiagent Systems,5A: Learning Agents,2,400,"Xiaotian Hao ,Weixun Wang ,Yaodong Yang ,Jianye Hao ",Independent Generative Adversarial Self-Imitation Learning in Cooperative Multiagent Systems,TRUE
,fp0402,Bandit Learning with Biased Human Feedback,5A: Learning Agents,3,402,"Wei Tang ,Chien-Ju Ho ",Bandit Learning with Biased Human Feedback,TRUE
,fp0802,Robot Learning by Collaborative Network Training: A Self-Supervised Method using Ranking,5A: Learning Agents,4,802,"Mason Bretan ,Sageev Oore ,Siddharth Sanan ,Larry Heck ",Robot Learning by Collaborative Network Training: A Self-Supervised Method using Ranking,TRUE
,fp0618,Using Causal Analysis to Learn Specifications from Task Demonstrations,5B: Human-Robot interaction,1,618,"Daniel Angelov ,Yordan Hristov ,Subramanian Ramamoorthy ",Using Causal Analysis to Learn Specifications from Task Demonstrations,TRUE
,fp0791,Human-guided Trajectory Adaptation for Tool Transfer,5B: Human-Robot interaction,2,791,"Tesca Fitzgerald ,Elaine Short ,Ashok Goel ,Andrea L. Thomaz ",Human-guided Trajectory Adaptation for Tool Transfer,TRUE
,fp0961,Distributed Heterogeneous Robot-Human Teams,5B: Human-Robot interaction,3,961,"S M Al Mahi ,Kyungho Nam ,Christopher Crick ",Distributed Control of Heterogeneous Teams of Robots and Humans,FALSE
,fp0352,Discriminatively Learning Inverse Optimal Control Models for Predicting Human Intentions,5B: Human-Robot interaction,4,352,"Sanket Gaurav ,Brian Ziebart ",Learning Inverse Optimal Control Models for Predicting Human Intentions,FALSE
,fp0461,Fraud Regulating Policy for E-Commerce via Constrained Contextual Bandits,5C: Industrial Applications Track,1,461,"Zehong Hu ,Zhen Wang ,Zhao Li ,Shichang Hu ,Shasha Ruan ,Jie Zhang ",Fraud Regulating Policy for E-Commerce via Constrained Contextual Bandits,TRUE
,fp0884,A Multi-task Selected Learning Approach for Solving  3D Flexible Bin Packing Problem,5C: Industrial Applications Track,2,884,"Lu Duan ,Haoyuan Hu ,Yu Qian ,Yu Gong ,Xiaodong Zhang ,Jiangwen Wei ",A Multi-task Selected Learning Approach for Solving 3D Flexible Bin Packing Problem,FALSE
,fp0539,Can Sophisticated Dispatching Strategy Acquired by Reinforcement Learning?,5C: Industrial Applications Track,3,539,"Yujie Chen ,Yu Qian ,Yichen Yao ,Zili Wu ,Rongqi Li ,Yinzhi Zhou ,Haoyuan Hu ,Yinghui Xu ",Can sophisticated Dispatching Strategy Acquired by Reinforcement Learning?,FALSE
,fp0924,FASTER: Fusion AnalyticS for public Transport Event Response,5C: Industrial Applications Track,4,924,"Sebastien Blandin ,Laura Wynter ,Basile Dura ",FASTER: Fusion AnalyticS for public Transport Event Response,TRUE
,fp0153,Algorithms for Gerrymandering over Graphs,5D: Social Choice Theory 3,1,153,"Takehiro Ito,Naoyuki Kamiyama,Yusuke Kobayashi,Yoshio Okamoto",Algorithms for Gerrymandering Over Graphs,FALSE
,fp0278,Modeling  People's  Voting Behavior with Poll Information,5D: Social Choice Theory 3,2,278,"Roy Fairstein ,Adam Lauz ,Kobi Gal ,Reshef Meir",Modeling People's Voting Behavior with Poll Information,FALSE
,fp0669,Fall if it Lifts your Teammate: A Novel Type of Candidate Manipulation,5D: Social Choice Theory 3,3,669,"Justin Kruger ,Sebastian Schneckenburger ",Fall if it lifts your teammate: a novel type of candidate manipulation,FALSE
,jams889,How Hard Is It to Control a Group?,5D: Social Choice Theory 3,4,889,"Yongjie Yang, Dinko, Dimitrov",How Hard Is It to Control a Group?,TRUE
,fp0879,Facility Location Games with Externalities,5E: Auctions and Mechanism Design,1,879,"Minming Li ,Lili Mei ,Yi Xu ,Guochuan Zhang ,Yingchao Zhao ",Facility Location Games with Externalities,TRUE
,fp0527,Manipulations-resistant Facility Location Mechanisms for ZV-line Graphs,5E: Auctions and Mechanism Design,2,527,"Ilan Nehama ,Taiki Todo ,Makoto Yokoo ",Manipulations-resistant facility location mechanisms for ZV-line graphs,FALSE
,fp0258,Heterogeneous Two-facility Location Games with Minimum Distance Requirement,5E: Auctions and Mechanism Design,3,258,"Lingjie Duan ,Bo Li  ,Minming Li ,Xinping Xu",Heterogeneous Two-facility Location Games with Minimum Distance Requirement,TRUE
,fp0547,Truthful Mechanisms for Location Games of Dual-Role Facilities,5E: Auctions and Mechanism Design,4,547,"Xujin Chen ,Minming Li ,Changjun Wang ,Chenhao Wang ,Yingchao Zhao ",Truthful Mechanisms for Location Games of Dual-Role Facilities,TRUE
,fp0634,Balanced task allocation by partitioning the multiple traveling salesperson problem,5F: Agent Cooperation 1,1,634,"Isaac Vandermeulen ,Roderich Gross ,Andreas Kolling ",Balanced task allocation by partitioning the multiple traveling salesperson problem,TRUE
,fp0975,Distributed Environmental Modeling and Adaptive Sampling for Multi-Robot Sensor Coverage,5F: Agent Cooperation 1,2,975,"Wenhao Luo ,Changjoo Nam ,George Kantor ,Katia Sycara ",Distributed Environmental Modeling and Adaptive Sampling for Multi-Robot Sensor Coverage,TRUE
,fp0965,Graph Based Optimization for Multiagent Cooperation,5F: Agent Cooperation 1,3,965,"Arambam Singh ,Akshat Kumar ",Graph Based Optimization For Multiagent Cooperation,FALSE
,fp0075,PT-ISABB: A Hybrid Tree-based Complete Algorithm to Solve Asymmetric Distributed Constraint Optimization Problems,5F: Agent Cooperation 1,4,75,"Yanchen Deng, Ziyu Chen, Dingding Chen, Xingqiong Jiang, Qiang Li",PT-ISABB: A Hybrid Tree-based Complete Algorithm to Solve Asymmetric Distributed Constraint Optimization Problems,TRUE
,fp0054,Adversarial Coordination on Social Networks,5G: Networks,1,54,"Sixie Yu, Zlatko Joveski, Yifan Guo, Yevgeniy Vorobeychik, Chen Hajaj",Adversarial Coordination on Social Networks,TRUE
,fp0170,Group Segregation in Social Networks,5G: Networks,2,170,"Dominic Aits,Alexander Carver,Paolo Turrini",Group Segregation in Social Networks,TRUE
,jams892,A Context-aware Convention Formation Framework for Large-Scale Networks,5G: Networks,3,892,"Mohammad, Hasan, hasan@unl.edu, University of Nebraska-Lincoln,Computer Science & Engineering,US, NE,Anita, Raja, araja@cooper.edu, The Cooper Union,Albert Nerken School of Engineering,US, NY,Ana, Bazzan, bazzan@inf.ufrgs.br, ,,,",A Context-aware Convention Formation Framework for Large-Scale Networks,TRUE
,jams890,An Agent Model Based on Open Linked Data for Building Internet of Agents Ecosystems,5G: Networks,4,890,"Pablo Pico-Valencia, Juan A., Holgado-Terriza, Jose Senso",An Agent model based on Open Linked Data for building Internet of Agents Ecosystems,FALSE
,fp0315,Marginal Cost Pricing with a Fixed Error Factor in Traffic Networks,6A: Agent-Based Simulation,1,315,"Guni Sharon,Stephen Boyles,Shani Alkoby ,Peter Stone ",Marginal Cost Pricing with a Fixed Error Factor in Traffic Networks,TRUE
,fp0192,Microscopic Traffic Simulation by Cooperative Multi-agent Deep Reinforcement Learning,6A: Agent-Based Simulation,2,192,"Giulio Bacchiani ,Daniele Molinari ,Marco Patander",Microscopic Traffic Simulation by Cooperative Multi-agent Deep Reinforcement Learning,TRUE
,fp0805,Outcome-based Partner Selection in Collective Risk Dilemmas,6A: Agent-Based Simulation,3,805,"Fernando Santos ,Samuel Mascarenhas ,Francisco C. Santos ,Filipa Correia ,Samuel Gomes ,Ana Paiva ",Outcome-based Partner Selection in Collective Risk Dilemmas,TRUE
,fp0848,Safe Policy Search Using Gaussian Process Models,6A: Agent-Based Simulation,4,848,"Kyriakos Polymenakos ,Stephen Roberts ,Alessandro Abate ",Safe Policy Search Using Gaussian Process Models,TRUE
,fp0131,Obviously Strategyproof Mechanisms without Money for Scheduling,6B: Auctions and Mechanism Design,1,131,"Maria Kyropoulou,Carmine Ventre",Obviously Strategyproof Mechanisms without Money for Scheduling,TRUE
,fp0340,Revenue Maximization with Imprecise Distribution,6B: Auctions and Mechanism Design,2,340,"Yingkai Li ,Pinyan Lu ,Haoran Ye ",Revenue Maximization with Imprecise Distribution,TRUE
,fp0535,Buyer Signaling Games in Auctions,6B: Auctions and Mechanism Design,3,535,"Weiran Shen ,Pingzhong Tang ,Yulong Zeng ",Buyer Signaling Game in Auctions,FALSE
,fp0324,Forecast-Based Mechanisms for Demand Response,6B: Auctions and Mechanism Design,4,324,"Georgios Methenitis ,Michael Kaisers ,Han La Poutre ",Forecast-Based Mechanisms for Demand Response,TRUE
,fp0650,Runtime Revision of Norms and Sanctions based on Agent Preferences,6C: Engineering Multiagent Systems 2,1,650,"Davide Dell'Anna ,Mehdi Dastani ,Fabiano Dalpiaz ",Runtime Revision of Norms and Sanctions based on Agent Preferences,TRUE
,fp0974,Effective Collective Summarisation of Distributed Data in Mobile Multi-Agent Systems,6C: Engineering Multiagent Systems 2,2,974,"Giorgio Audrito ,Sergio Bergamini ,Ferruccio Damiani ,Mirko Viroli ",Effective Collective Summarisation of Distributed Data in Mobile Multi-Agent Systems,TRUE
,fp0244,Unsupervised Role Discovery Using Temporal Observations of Agents,6C: Engineering Multiagent Systems 2,3,244,"Andrew Silva,Sonia Chernova",Unsupervised Role Discovery Using Temporal Observations of Agents,TRUE
,fp0889,The Matrix: An Agent-Based Modeling Framework for Data Intensive Simulations,6C: Engineering Multiagent Systems 2,4,889,"Parantapa Bhattacharya ,Christian Lebiere ,Samarth Swarup ,Saliya Ekanayake ,Chris Kuhlman ,Don Morrison ,Mandy Wilson ,Mark Orr ",The Matrix: An Agent-Based Modeling Framework for Data Intensive Simulations,TRUE
,fp0198,Trusted AI and the Contribution of Trust Modeling in Multiagent Systems,6D: Blue Sky,1,198,"Robin Cohen ,Mike Schaekermann,Sihao Liu ,Michael Cormier",Trusted AI and the contribution of trust modeling in multiagent systems,FALSE
,fp0697,Between the Megalopolis and the Deep Blue Sky: Challenges of Transport with UAVs in Future Smart Cities,6D: Blue Sky,2,697,"Yazan Mualla, Amro Najjar  , Stéphane Galland   , Christophe Nicolle , Igor Tchappi Haman , Ansar Yasar , Kary Främling",Between the Megalopolis and the Deep Blue Sky: Challenges of Transport with UAVs in Future Smart Cities,TRUE
,fp0532,Beyond Autonomy: The Self and Life of Social Agents,6D: Blue Sky,3,532,"Budhitama Subagdja ,Ah-Hwee Tan ",Beyond Autonomy: The Self and Life of Social Agents,TRUE
,fp0721,A Decade in Hindsight: The Missing Bridge Between Multi-Agent Systems and the World Wide Web,6D: Blue Sky,4,721,"Andrei Ciortea ,Simon Mayer ,Fabien Gandon ,Olivier Boissier ,Alessandro Ricci ,Antoine Zimmermann ",A Decade in Hindsight: The Missing Bridge Between Multi-Agent Systems and the World Wide Web,TRUE
,fp0762,Stream Reasoning Agents,6D: Blue Sky,5,762,"Riccardo Tommasini ,Jean Paul Calbimonte ,Davide Calvaresi ",Stream Reasoning Agents,TRUE
,fp0247,Online Resource Allocation with Matching Constraints,6E: Agent Cooperation 2,1,247,"John P. Dickerson ,Karthik Abinav Sankararaman ,Kanthi Sarpatwar  ,Aravind Srinivasan  ,Kun-Lung Wu ,Pan Xu",Online Resource Allocation with Matching Constraints,TRUE
,jams891,Type Checking for Protocol Role Enactments via Commitments,6E: Agent Cooperation 2,2,891,"Matteo Baldoni, Cristina Baroglio, Federico Capuzzimati, Roberto Micalizio",Type Checking for Protocol Role Enactments via Commitments,TRUE
,fp0523,Multi-unit Budget Feasible Mechanisms for Cellular Traffic Offloading,6E: Agent Cooperation 2,3,523,"Jun Wu ,Yuan Zhang ,Yu Qiao ,Lei Zhang ,Chongjun Wang ,Junyuan Xie ",Multi-unit Budget Feasible Mechanisms for Cellular Traffic Offloading,TRUE
,jams897,Computing Optimal Coalition Structures in Polynomial Time,6E: Agent Cooperation 2,4,897,"Shaheen Fatima, Michael Wooldridge",Computing Optimal Coalition Structures in Polynomial Time,TRUE
,fp0563,A Fully Rational Argumentation System for Preordered Defeasible Rules,6F: Communication and Argumentation 2,1,563,"Jesse Heyninck , Christian Straßer",A fully rational argumentation system for preordered defeasible rules,FALSE
,fp0124,Complexity Results and Algorithms for Bipolar Argumentation,6F: Communication and Argumentation 2,2,124,"Amin Karamlou,Kristijonas Cyras,Francesca Toni",Complexity Results and Algorithms for Bipolar Argumentation,TRUE
,fp0137,Extending Modular Semantics for Bipolar Weighted Argumentation,6F: Communication and Argumentation 2,3,137,Nico Potyka ,Extending Modular Semantics for Bipolar Weighted Argumentation,TRUE
,fp0125,Resolving Conflicts in Clinical Guidelines using Argumentation,6F: Communication and Argumentation 2,4,125,"Kristijonas Cyras,Tiago Oliveira",Resolving Conflicts in Clinical Guidelines using Argumentation,TRUE
,jams887,Comparative Criteria for Partially Observable Contingent Planning,6G: Planning & Learning,1,887,"Dorin Shmaryahu, Guy Shani, Joerg Hoffman",Comparative Criteria for Partially Observable Contingent Planning,TRUE
,fp0918,Attack-Resilient Connectivity Game for UAV Networks using Generative Adversarial Learning,6G: Planning & Learning,2,918,"Bo Yang ,Min Liu ",Attack-Resilient Connectivity Game for UAV Networks using Generative Adversarial Learning,TRUE
,fp0023,The Impact of Agent Definitions and Interactions on Multiagent Learning for Coordination,6G: Planning & Learning,3,23," Jen Jen Chung, Damjan Miklić , Lorenzo Sabattini , Kagan Tumer , Roland Siegwart",The impact of agent definitions and interactions on multiagent learning for coordination,FALSE
,jams886,An Agent-Based Model of the Emergence and Evolution of a Language System for Boolean Coordination,6G: Planning & Learning,4,886,Josefina Sierra-Santibáñez,An Agent-Based Model of the Emergence and Evolution of a Language System for Boolean Coordination,TRUE